{
  "$schema": "https://json-schema.org/draft/2020-12/schema",
  "title": "Decision Log (ADR)",
  "type": "object",
  "required": ["id", "title", "status", "context", "decision", "consequences", "date"],
  "properties": {
    "id": { "type": "string" },
    "title": { "type": "string" },
    "status": { "type": "string", "enum": ["proposed", "accepted", "rejected", "superseded"] },
    "context": { "type": "string" },
    "decision": { "type": "string" },
    "consequences": { "type": "string" },
    "date": { "type": "string" },
    "supersedes": { "type": "string" }
  }
}
